id_str,created_at,text,retweeted,favorite_count,in_reply_to_screen_name
1484262714130288648,2022-01-20 20:33:01+00:00,"One year ago, we started to write an American story of hope, not fear. 
Of unity, not division. 
Of light, not darkness.

An American story of decency and dignity.
Of love and of healing.
Of greatness and of goodness.

May this be the story that continues to guide us forward.",False,12829,
1484215137284333573,2022-01-20 17:23:58+00:00,"I've never been more optimistic about America's future. 
https://t.co/UzOdpHW5RB",False,5793,
1484210869928144901,2022-01-20 17:07:01+00:00,"RT @POTUS: 210 million Americans fully vaccinated.
96% of schools open.
6.4 million jobs created.
3.9% unemployment.
5 million Americans ga…",False,0,
1484198537306984451,2022-01-20 16:18:01+00:00,"Our first year was the greatest year of job growth in modern American history, including over 6 million jobs added—more in one year than ever on record. We have more work ahead, but I know we can do it together.",False,18914,
1484173968051425281,2022-01-20 14:40:23+00:00,"January 20, 2021 was a day of renewal and resolve for our nation. With hope, we set our sights on a nation we knew we could be and must be. 

And it was just the beginning. https://t.co/VDhqch8xU9",False,8855,
1484008488913326081,2022-01-20 03:42:49+00:00,RT @POTUS: I am profoundly disappointed that the Senate has failed to stand up for our democracy. I am disappointed — but I am not deterred…,False,0,
1483970281685270534,2022-01-20 01:11:00+00:00,"From getting more than 200 million Americans fully vaccinated to the addition of over 6 million new jobs, we’ve made record progress for working families over the last year.",False,26019,
1483854287776141318,2022-01-19 17:30:05+00:00,"A year ago, we set out to write the next chapter in the American story.

Join me and Vice President @KamalaHarris this Thursday for a virtual event as we reflect on our first year and look ahead to the future.
https://t.co/tBNkNnRQNw",False,7056,
1483446750169997313,2022-01-18 14:30:41+00:00,"RT @POTUS: Jim Crow 2.0 is about two insidious things: voter suppression and election subversion. It’s about making it harder to vote, who…",False,0,
1483118182965690372,2022-01-17 16:45:04+00:00,"On Martin Luther King, Jr. Day, we must protect the hard-fought gains he helped achieve—and continue his unfinished struggle for a freer and more just society by raising our voices to confront abuses of power, challenge hate and discrimination, and protect the right to vote.",False,34424,
1483089224073162753,2022-01-17 14:50:00+00:00,"RT @POTUS: On Martin Luther King Jr. Day, we must commit to his unfinished work – of delivering jobs and justice, and protecting the sacred…",False,0,
1482787992146259968,2022-01-16 18:53:00+00:00,"If you have not gotten vaccinated, do it. Personal choice impacts all of us—our hospitals, our country. 

COVID-19 is one of the most formidable things America's ever faced. We have to work together, not against each other. We are the United States of America. We can do this.",False,31225,
1482396411236917253,2022-01-15 16:57:00+00:00,"Repairing and rebuilding our nation's bridges
Delivering clean water for every American
Expanding access to high-speed internet 
Building resilience against severe weather

The Bipartisan Infrastructure Law is making critical investments that we've never seen before.",False,12858,
1482166143494369284,2022-01-15 01:42:00+00:00,"Across the country, 45,000 of our bridges are in desperate need of repair. My Bipartisan Infrastructure Law includes $40 billion to make those repairs.",False,25787,
1482026474102300673,2022-01-14 16:27:00+00:00,"I’ve said it before: If you are unvaccinated, and test positive, you are 17 times more likely to get hospitalized.

The best way to keep yourself and your family safe is to get vaccinated, boosted, and wear a mask indoors and in public spaces.",False,39028,
1481998275800711179,2022-01-14 14:34:57+00:00,"RT @POTUS: Great news, folks. A record 10 million people have enrolled in health care through https://t.co/gRX1fGFEzj since November 1st.…",False,0,
1481687240011091968,2022-01-13 17:59:01+00:00,"21st century Jim Crow is about voter suppression and subversion—it’s about who gets to vote, who counts your vote, and whether your vote is counted.

The Senate must pass the John Lewis Voting Rights Advancement Act and the Freedom to Vote Act.",False,22884,
1481656544878120961,2022-01-13 15:57:02+00:00,"RT @POTUS: I am directing my team to procure 500 million more COVID-19 at-home, rapid tests. 

That will mean one billion tests to be distr…",False,0,
1481428029805060102,2022-01-13 00:49:00+00:00,"It’s not enough to praise Congressman John Lewis’ memory. In order to follow in his footsteps, we must translate eulogy into action and support the bill in his name.

The Senate must pass the John Lewis Voting Rights Advancement Act and the Freedom to Vote Act.",False,20728,
1481390084696035332,2022-01-12 22:18:13+00:00,"Last year alone, 34 laws were enacted in 19 states with provisions restricting voting rights.

What’s their end game? To turn the will of the voters into a mere suggestion. https://t.co/T9ufFTgqYz",False,9623,
1481344042562695172,2022-01-12 19:15:16+00:00,"The right to vote and to have that vote counted is democracy’s threshold liberty. Without it, nothing is possible.

This is about all of us. It’s about the people. It’s about America. https://t.co/nfBiII7uvk",False,8182,
1481300188606222340,2022-01-12 16:21:00+00:00,"I'll be clear: to protect our democracy, I support changing the Senate rules to prevent a minority of senators from blocking action on voting rights.",False,59363,
1481028679685873664,2022-01-11 22:22:08+00:00,"RT @POTUS: When it comes to protecting majority rule in America, a majority should rule in the United States Senate.
 
To protect our democ…",False,0,
1481011265556430851,2022-01-11 21:12:56+00:00,RT @POTUS: Tune in as I deliver remarks on the urgent need to pass legislation to protect the constitutional right to vote and the integrit…,False,0,
1480915474464526345,2022-01-11 14:52:17+00:00,RT @POTUS: History has never been kind to those who have sided with voter suppression over voting rights. And it will not be kind to those…,False,0,
1480678187722059777,2022-01-10 23:09:24+00:00,"RT @POTUS: January 6, 2021 made it clear: there is a dagger at the throat of our democracy.
 
Tomorrow, I’m headed to Atlanta where I will…",False,0,
1480311475638046724,2022-01-09 22:52:13+00:00,"Since the start of my presidency, Republicans have done nothing but try to obstruct the country's economic recovery. https://t.co/WivbP7JWNF",False,19906,
1480209753095688197,2022-01-09 16:08:00+00:00,"From day one, my economic agenda has been different. It's been about taking a fundamentally new approach to our economy: one that sees the prosperity of working families as a solution, not the problem.",False,31714,
1479976616252039168,2022-01-09 00:41:36+00:00,"RT @POTUS: Harry Reid and I grew up on different sides of the country, but we came from the same place where certain values run deep. Loyal…",False,0,
1479842843644645377,2022-01-08 15:50:02+00:00,"RT @POTUS: Yesterday afternoon, I visited Colorado to see the aftermath of the recent wildfire firsthand and meet with those impacted. As I…",False,0,
1479640911462248448,2022-01-08 02:27:38+00:00,"RT @POTUS: The son of tomato farmers in the Bahamas, Sidney Poitier became the first Black man to win the Academy Award for Best Actor — bu…",False,0,
1479631030709624834,2022-01-08 01:48:22+00:00,"I believe the power of the presidency and the purpose is to unite this nation, not divide it. https://t.co/RzELTfTV9a",False,14118,
1479595957343895553,2022-01-07 23:29:00+00:00,"Right now, in states throughout the country, new laws are being written not to protect the vote, but to deny it. The former president and his supporters want not only to suppress the vote, but to subvert it. 

It’s wrong, undemocratic, and un-American.",False,35974,
1479579411812954122,2022-01-07 22:23:15+00:00,Today’s a historic day for America’s economic recovery. https://t.co/PG8EAIk415,False,5711,
1479565323066134531,2022-01-07 21:27:16+00:00,The election of 2020 was the greatest demonstration of democracy in the history of this country. https://t.co/49b2vmejBz,False,7656,
1479554183237935113,2022-01-07 20:43:00+00:00,"Folks, get your booster.",False,106164,
1479522725416816641,2022-01-07 18:38:00+00:00,The FDA has now authorized booster shots for children ages 12 to 15. Vaccinating our children is the best way to protect them from the Omicron variant.,False,16029,
1479516003675652102,2022-01-07 18:11:18+00:00,"We must be absolutely clear about what is true and what is a lie. 

The former president did what no president in the history of this country has ever done: He refused to accept the results of an election and the will of the American people. https://t.co/QCWCcbofUM",False,12434,
1479460570847973378,2022-01-07 14:31:01+00:00,"Folks, I know we're all tired and frustrated about the pandemic.

But please, wear your mask in public to protect yourself and others. Get vaccinated and boosted. Take advantage of what resources we already have. We’ll get through this—together.
https://t.co/2CbSjLwOcG",False,13856,
1479255214284812293,2022-01-07 00:55:00+00:00,"Folks, we have a responsibility to see that America is an idea. One that requires vigilant stewardship.

As we stand here today, one year since January 6, 2021, we must be firm and resolute and unyielding in our defense of the right to vote and to have that vote counted.",False,21386,
1479236394161778689,2022-01-06 23:40:13+00:00,"I did not seek this fight brought to this Capitol one year ago today, but I will not shrink from it either. 

I will stand in this breach and defend this nation. I will not allow anyone to place a dagger at the throat of democracy. The will of the people will be heard. https://t.co/spR4EkrVb7",False,14194,
1479226302423044103,2022-01-06 23:00:07+00:00,You cannot love your country only when you win. You cannot obey the law only when it's convenient. You cannot be patriotic when you embrace and enable lies.,False,151709,
1479215017274847237,2022-01-06 22:15:17+00:00,"Here is the truth about what we saw on January 6, 2021: Rioters menaced the halls of the Capitol. They were not looking to save the cause of America, but to subvert the Constitution. https://t.co/fvzTT3Czos",False,13867,
1479203536256831508,2022-01-06 21:29:39+00:00,"One year ago, democracy was attacked. 

For the first time in our history, a president tried to prevent the peaceful transition of power as a violent mob reached the Capitol. 

But they failed. We must work to ensure that it never happens again.",False,47183,
1479104150428209157,2022-01-06 14:54:44+00:00,"RT @POTUS: Here is the truth: The former president of the United States has created and spread a web of lies about the 2020 election.

He’s…",False,0,
1479092205990121479,2022-01-06 14:07:16+00:00,RT @POTUS: Tune in as I deliver remarks to mark one year since the January 6th deadly assault on the Capitol. https://t.co/nvklC2pgl8,False,0,
1479084731627184128,2022-01-06 13:37:34+00:00,"RT @POTUS: One year ago today, democracy was attacked. The will of the people was under assault. And our Constitution faced the gravest of…",False,0,
1478865897750245393,2022-01-05 23:08:00+00:00,"Let’s be clear: Booster shots work. They’re safe and provide the highest level of protection against the Omicron variant. 
https://t.co/sDOh06E5dD",False,10535,
1478840731968184325,2022-01-05 21:28:00+00:00,The COVID-19 vaccine and booster are our best defense to end this pandemic—and the best way to protect yourself and your loved ones. Get vaccinated.,False,24909,
1478835951518552066,2022-01-05 21:09:00+00:00,"Millions rely on public transit every day—to get to work, to school, to visit with family. But many communities, especially communities of color, lack sufficient transit options. 

My Bipartisan Infrastructure Law will expand public transit and replace outdated vehicles.",False,8235,
1478798705352396802,2022-01-05 18:41:00+00:00,"If you’re fully vaccinated and boosted, you are highly protected from the Omicron variant.

And we have enough vaccines to get every American fully vaccinated, including their booster shot. Get vaccinated, folks.",False,37378,
1478498476845682694,2022-01-04 22:48:00+00:00,"Folks, get vaccinated.",False,157678,
1478455879875899395,2022-01-04 19:58:44+00:00,"RT @POTUS: Today, we are doubling our Pfizer antiviral pill order from 10 million to 20 million treatment courses.
 
These pills have been…",False,0,
1478114449450049545,2022-01-03 21:22:01+00:00,"This year, we'll keep: 

Investing in America.
Rebuilding America.
And building a better America for all. https://t.co/TCdzmyDtrp",False,23524,
1478040106980331522,2022-01-03 16:26:36+00:00,"RT @POTUS: Right now, 400,000 schools and child care centers are at risk of exposure to lead in their water. It’s unacceptable.
 
We’re rep…",False,0,
1477340350947725322,2022-01-01 18:06:01+00:00,"In 2022, we’re going to keep building a better America. Happy New Year! https://t.co/RWAayKDwJH",False,140622,
1477152612231389186,2022-01-01 05:40:01+00:00,"RT @POTUS: Happy New Year, folks! https://t.co/UrgNq8iZuE",False,0,
1477038711351259145,2021-12-31 22:07:25+00:00,RT @POTUS: Betty White brought a smile to the lips of generations of Americans. She’s a cultural icon who will be sorely missed. Jill and I…,False,0,
1476618089273905158,2021-12-30 18:16:01+00:00,"This new sinister combination of voter suppression and election subversion—it's un-American and it's undemocratic.

We must pass the Freedom to Vote Act and the John Lewis Voting Rights Advancement Act.",False,46688,
1476597193230503938,2021-12-30 16:52:59+00:00,"RT @POTUS: When I came into office, our economy was in crisis. 
 
But over the last 11 months, we’ve added nearly 6 million jobs.
 
That’s…",False,0,
1476388733385678851,2021-12-30 03:04:38+00:00,"RT @POTUS: Today, I committed $137 million to expanding the production of COVID-19 at-home tests using our military authority in order to m…",False,0,
1476034320833859584,2021-12-29 03:36:20+00:00,"RT @POTUS: A son of Searchlight, Nevada, Harry never forgot his humble roots. A boxer, he never gave up a fight. A great American, he looke…",False,0,
1475971575249874947,2021-12-28 23:27:00+00:00,"As we continue our holiday celebrations and head into the new year, remember that the best way to protect your health and keep your loved ones safe from COVID-19 and the Omicron variant is to get vaccinated and get your booster shot.",False,20179,
1475967046450139144,2021-12-28 23:09:00+00:00,"RT @POTUS: My Administration has the back of every governor fighting COVID-19 in their state. Last week, I rolled out a federal plan to tac…",False,0,
1475923008925614082,2021-12-28 20:14:01+00:00,"The most valuable tool we have to lower the costs of prescription drugs, child care, and health care for families is my Build Back Better Act. 

It’s fully paid for, will not increase the deficit, and won’t raise the taxes by one penny for anyone making less than $400,000 a year.",False,16537,
1475565652010319877,2021-12-27 20:34:00+00:00,"When it comes to voter suppression, it’s no longer just about making it easy for eligible people to vote—it's about whether or not those votes will count at all.

It's simple: voter suppression is un-American, un-democratic, and unpatriotic.",False,38489,
1475203037132210185,2021-12-26 20:33:06+00:00,"RT @POTUS: Today, we are heartbroken to learn of the passing of a true servant of God and of the people, Archbishop Desmond Tutu of South A…",False,0,
1475144376175235073,2021-12-26 16:40:00+00:00,"Sending warm wishes to all who are celebrating Kwanzaa this week. We hope these days of reflection on the seven principles bring light, happiness, and peace in the coming year.",False,26324,
1474763376563789834,2021-12-25 15:26:03+00:00,"On behalf of the entire Biden family, Jill and I want to wish you a very Merry Christmas. https://t.co/2dIRa6XIEV",False,55954,
1474761668152471554,2021-12-25 15:19:16+00:00,"RT @POTUS: From our family to yours, Merry Christmas! May your time with loved ones be filled with warmth, comfort, and joy this holiday se…",False,0,
1474540043423391744,2021-12-25 00:38:36+00:00,"RT @POTUS: This morning, the First Lady and I stopped by the Children’s National Hospital to spread a little holiday cheer. We hope everyon…",False,0,
1474188578758533123,2021-12-24 01:22:00+00:00,"Gas prices are down ten cents nationally, and some states across the country are seeing gas prices at pre-pandemic averages. This will help so many Americans who are traveling this week.",False,56307,
1474161901865259010,2021-12-23 23:36:00+00:00,"Packages are moving, gifts are being delivered, and shelves are stocked. Today, retail inventories are up more than 3% from last year. 

We’re making progress.",False,36846,
1474142214171287555,2021-12-23 22:17:46+00:00,"RT @POTUS: I had the honor of hosting the 2021 Kennedy Center Honorees this month at the White House. These folks are giants of the arts, a…",False,0,
1474095416077660172,2021-12-23 19:11:49+00:00,"RT @POTUS: We should all be concerned about Omicron, but not panicked.

If you’re fully vaccinated — and especially if you got boosted — yo…",False,0,
1474082380851855368,2021-12-23 18:20:01+00:00,"My Bipartisan Infrastructure Law includes the largest investment of public transit ever and will replace diesel buses with electric ones. This will get more people where they are going safer, faster, and cleaner for the environment. It’s a win, win, win.",False,12342,
1473817128910401541,2021-12-23 00:46:00+00:00,"Two years earlier than experts predicted, the economy has added nearly 6 million jobs and the unemployment rate is down to 4.2%. Let’s keep this historic progress moving by passing Build Back Better.",False,21924,
1473790705743056899,2021-12-22 23:01:00+00:00,"If you're over the age of 18 and six months have gone by since you got vaccinated, go get your booster. Go get it now.",False,64272,
1473739730311389191,2021-12-22 19:38:27+00:00,"RT @POTUS: Today, I announced my Administration is extending the pause on federal student loan repayments for an additional 90 days. https:…",False,0,
1473731819673694211,2021-12-22 19:07:01+00:00,"We are not going back to March 2020. 

More than 200 million Americans have been fully vaccinated and today, we’re prepared for what’s coming. We must stay focused.",False,19321,
1473667190310199302,2021-12-22 14:50:12+00:00,"If you haven’t yet, please get vaccinated. It’s the best way to keep yourself and your loved ones safe from the Omicron variant. Now is the time. https://t.co/nLva52NSGI",False,9143,
1473472357440315394,2021-12-22 01:56:00+00:00,Booster shots provide the strongest protection against the Omicron variant. That’s why I got my booster—and encourage everyone who’s eligible to do so as well. https://t.co/7sEoXNjr9D,False,8393,
1473454994099687433,2021-12-22 00:47:00+00:00,"To the Americans who are wondering whether you can safely celebrate the holidays this weekend: the answer is yes, you can. 

If you and your families are vaccinated and follow the precautions, you should feel comfortable celebrating the Christmas holiday as you have planned.",False,21649,
1473451662064902144,2021-12-22 00:33:46+00:00,RT @POTUS: We’re purchasing 500 million at-home rapid COVID tests that will be distributed for free to Americans who want them. https://t.c…,False,0,
1473121546638184451,2021-12-21 02:42:00+00:00,"RT @POTUS: Folks, Omicron cases are on the rise in the United States. I want to give you all a sense of where we are and what we know.",False,0,
1472983891002765313,2021-12-20 17:35:00+00:00,"RT @POTUS: Right now, there’s a kid out there whose family can’t afford her insulin because it costs $1,000 per month. The Build Back Bette…",False,0,
1471966938821767171,2021-12-17 22:14:00+00:00,"There aren't a lot of things that almost every American can agree on. But I think it's safe to say that all of us can agree that prescription drugs are outrageously expensive in our country. 

Under my Build Back Better bill, which has passed the House, they won’t be.",False,21789,
1471902859784556547,2021-12-17 17:59:23+00:00,"RT @POTUS: In my first year in office, we’ve passed two of the most important pieces of economic legislation in decades.
 
The third is in…",False,0,
1471848921374859269,2021-12-17 14:25:03+00:00,"Six months out from your second Pfizer or Moderna vaccine shot or two months out from your Johnson &amp; Johnson shot? 

Get your booster.",False,27226,
1471632488166477831,2021-12-17 00:05:01+00:00,"The shock of losing a home or business, the grief of losing a loved one during the holidays, is traumatizing. 

We are going to ensure that folks in Kentucky and all those affected by the tornadoes have all the mental health resources they need to get through this difficult time.",False,11638,
1471597260035272707,2021-12-16 21:45:02+00:00,"The Build Back Better Act will lower the core costs that have held Americans back for decades: on everything from health care and child care to prescription drugs and housing. 

No Republican in Congress supports it.",False,14192,
1471580901180063746,2021-12-16 20:40:02+00:00,"To the people of Kentucky who have been devastatingly impacted by these tornadoes, know this—I intend to do whatever it takes, for as long as it takes, to help support your state and your local leaders recover and rebuild.
https://t.co/YKcUPa74vt",False,7448,
1471557905992269832,2021-12-16 19:08:39+00:00,RT @POTUS: Join me as I award the Medal of Honor to three American soldiers and deliver remarks. https://t.co/2JzvzqSvOv,False,0,
1471529060295663626,2021-12-16 17:14:02+00:00,"The American people deserve more than just a little breathing room—they deserve a real fighting chance to get ahead. The Build Back Better Act will prioritize families like yours and rebuild the backbone of America.
https://t.co/YXwRRtrmJ2",False,5532,
1471291235377762305,2021-12-16 01:29:00+00:00,"If you are vaccinated but still worried about the new variant, get your booster. 
If you aren't vaccinated, go get that first shot. 
We’ll fight the Omicron variant, together.",False,35328,
1471161652850614274,2021-12-15 16:54:05+00:00,RT @POTUS: I’m in Kentucky today to meet with local leaders and to survey the damage from the tornadoes and extreme weather. It will take a…,False,0,
1470976341986230275,2021-12-15 04:37:44+00:00,"RT @POTUS: As we mark 800,000 American deaths due to COVID-19, we must remember all those we have lost — and pray for their loved ones, esp…",False,0,
1470863418257297417,2021-12-14 21:09:00+00:00,"RT @POTUS: Nine years ago today, we lost 20 precious first-graders and six heroic educators at Sandy Hook Elementary School. As a nation, w…",False,0,
1470818377358786571,2021-12-14 18:10:02+00:00,"Life-saving, prescription medication shouldn’t break the bank.
https://t.co/DGDEm6QC1l",False,6489,
1470797484532596737,2021-12-14 16:47:01+00:00,"As we move into the winter and face the challenges of a new variant, this is a moment for us to put the divisiveness behind us. This is a moment for the nation to unite in a common purpose: To fight this virus, protect one another, and to protect our economic recovery.",False,22145,
1470549850831958018,2021-12-14 00:23:00+00:00,"Everybody talks about the price tag for the Build Back Better Act. 

But here’s the truth: If you make less than $400,000 a year, your taxes will not go up one single penny under our plan.",False,30847,
1470506327524978695,2021-12-13 21:30:03+00:00,"Health care should be a right in this country, not a partisan issue. Diabetes, cancer, and other diseases don’t care whether you're a Democrat or a Republican. 

This is about being able to afford the prescription drugs you need. Congress must come together and finish the job.",False,14155,
1470486344069693455,2021-12-13 20:10:39+00:00,"RT @POTUS: Today, I was briefed by FEMA on our response to the tornadoes and extreme weather that impacted multiple states this weekend. We…",False,0,
1470438875202043908,2021-12-13 17:02:01+00:00,"The pandemic has put a strain on our global supply chains and caused prices to rise around the world. 

The Build Back Better Act will help ease inflationary pressures, lower costs for the American people and extend tax cuts for working families.",False,12138,
1470184193070145541,2021-12-13 00:10:00+00:00,"Our 5-step plan to fight COVID-19 this winter: 
1. Expanding the nationwide booster campaign 
2. Launching new family vaccination clinics 
3. Making at-home tests available 
4. Increasing surge response teams 
5. Accelerating our efforts to vaccinate the rest of the world",False,20952,
1470047549822320646,2021-12-12 15:07:02+00:00,"Parents should never have to worry about whether their drinking water is safe for their children. 

The Bipartisan Infrastructure Law will start to replace 100% of our nation’s lead pipes and service lines so that every child across the country has access to clean and safe water.",False,20878,
1469683727320203264,2021-12-11 15:01:20+00:00,"RT @POTUS: This morning, I was briefed on the devastating tornadoes across the central U.S. To lose a loved one in a storm like this is an…",False,0,
1469463494521196544,2021-12-11 00:26:13+00:00,America is entering this winter from a position of strength compared to where we were last winter. https://t.co/OE4gj0ZoCA,False,8341,
1469433519747526657,2021-12-10 22:27:06+00:00,RT @POTUS: I am deeply troubled by reports of Kellogg’s plans to permanently replace striking workers. Permanently replacing striking worke…,False,0,
