id_str,created_at,text,retweeted,favorite_count,in_reply_to_screen_name
1329206502414958593,2020-11-18 23:35:00+00:00,"The workers on the frontlines of this pandemic are making extraordinary sacrifices every single day. They deserve leaders who will listen and work as hard for them as they are for their communities. As president, that’s exactly what I’ll do. https://t.co/wDu0p3sUQ2",False,105475,
1329130715439525889,2020-11-18 18:33:51+00:00,The health care workers on the frontlines of this pandemic are true heroes. Tune in as we thank them for their work and discuss how a Biden-Harris administration will support them. https://t.co/RpBLnot7Be,False,52561,
1328837822950752259,2020-11-17 23:10:00+00:00,"Today, @KamalaHarris and I met with some of our country's most experienced national security experts to discuss the challenges facing our nation, our institutions, and the world. We're ready to tackle the challenges our administration will inherit on day one. https://t.co/J6DLvnwgM4",False,112578,
1328790008963227649,2020-11-17 20:00:00+00:00,I’m keeping in my prayers all of our friends and neighbors in Hurricane Iota’s path and those impacted by Hurricane Eta across Central America. The increasing frequency of these powerful storms is another reason that fighting climate change will be one of my top priorities.,False,258166,
1328734005404061701,2020-11-17 16:17:28+00:00,RT @Transition46: Our White House senior staff is composed of individuals who demonstrate the President-elect's commitment to building an a…,False,0,
1328474177007972354,2020-11-16 23:05:00+00:00,"Americans want us to cooperate. They want us to deliver results. That’s the choice Kamala and I will make. That's why I am pleased that today we were able to bring together business and labor leaders to make that choice with us.

We’re all Americans. Let’s get to work together.",False,128990,
1328467885279375361,2020-11-16 22:40:00+00:00,"When we build back better, we will do so with higher wages — including a $15 minimum wage — better benefits and stronger collective bargaining rights that you can raise a family on.

That’s how we will build back the middle class better than ever.",False,189223,
1328461593848397827,2020-11-16 22:15:00+00:00,"Right now, Congress should come together and pass a COVID relief package like the HEROES Act that the House passed six months ago. Once we shut down the virus and deliver economic relief to workers and businesses, then we can build back better than ever before.",False,296035,
1328425157229113344,2020-11-16 19:50:13+00:00,Tune in as I deliver remarks on our economic recovery and how my administration plans to build back better in the long term. https://t.co/JOoK9xBRm1,False,41275,
1328338891544387585,2020-11-16 14:07:25+00:00,"Once again, I congratulate the brilliant women and men who produced this breakthrough and have brought us one step closer to beating this virus. I am also thankful for the frontline workers who are still confronting the virus around the clock.",False,120951,JoeBiden
1328338687910928386,2020-11-16 14:06:37+00:00,"Today's news of a second vaccine is further reason to feel hopeful. What was true with the first vaccine remains true with the second: we are still months away. Until then, Americans need to continue to practice social-distancing and mask-wearing to get the virus under control.",False,364648,
1328133691529375751,2020-11-16 00:32:02+00:00,"Congratulations to NASA and SpaceX on today's launch. It’s a testament to the power of science and what we can accomplish by harnessing our innovation, ingenuity, and determination. I join all Americans and the people of Japan in wishing the astronauts Godspeed on their journey.",False,574108,
1328006638809329665,2020-11-15 16:07:10+00:00,"RT @Transition46: On today's anniversary of the Clean Air Act, the task of protecting the air we breathe has never been more urgent or more…",False,0,
1327649998092214273,2020-11-14 16:30:00+00:00,"To the millions of Hindus, Jains, Sikhs, and Buddhists celebrating the Festival of Lights, @DrBiden and I send our best wishes for a #HappyDiwali. May your new year be filled with hope, happiness, and prosperity. Sal Mubarak.",False,572331,
1327418361001676800,2020-11-14 01:09:34+00:00,"I am the president-elect, but will not be president until next year. COVID-19 does not respect dates on the calendar, it is accelerating right now. Urgent action is needed today, now, by the current administration.",False,189207,JoeBiden
1327418359848300545,2020-11-14 01:09:33+00:00,"I am alarmed by the surge in reported COVID-19 infections, hospitalizations, and fatalities. This crisis demands a robust and immediate federal response which has been woefully lacking.",False,405606,
1327394562906542080,2020-11-13 23:35:00+00:00,"As the remnants of Tropical Storm Eta continue to impact the east coast, I encourage everyone in its path to heed the warnings of emergency responders and local officials. Jill and I send our prayers to those facing yet another storm.",False,156411,
1327356814552305664,2020-11-13 21:05:00+00:00,"Today marks five years since the horrific ISIS terrorist attacks in Paris — an assault not just on the people of France but against our common humanity.

As president, I will work to protect Americans and our allies, countering terrorism and extremist violence in all forms.",False,202395,
1326968002839908353,2020-11-12 19:20:00+00:00,"I extend my deep condolences to the loved ones of the peacekeepers, including 6 American service members, who died on Tiran Island, and wish a speedy recovery to the surviving American. I join all Americans in honoring their sacrifice, as I keep their loved ones in my prayers.",False,464814,
1326956772175863810,2020-11-12 18:35:22+00:00,RT @Transition46: President-elect Biden spoke this morning with His Holiness Pope Francis. https://t.co/om635SC3M9 https://t.co/DYuiiphOE0,False,0,
1326955421320450049,2020-11-12 18:30:00+00:00,"Because of the Affordable Care Act:

- People with pre-existing conditions are protected
- More than 20 million Americans gained coverage
- Nearly 12 million seniors have had their prescription drug costs reduced

Now more than ever, we have to protect and build on it. https://t.co/Vl5yliyUFm",False,97856,
1326696150364286976,2020-11-12 01:19:45+00:00,"Ron Klain’s deep, varied experience and capacity to work with people all across the political spectrum is precisely what I need in a White House chief of staff as we confront this moment of crisis and bring our country together again. https://t.co/s4XlAgMrxf",False,195245,
1326638331204038656,2020-11-11 21:30:00+00:00,"This Veterans Day, I feel the full weight of the honor and the responsibility that has been entrusted to me by the American people as the next president, and I vow to honor our country’s sacred obligation. https://t.co/BuynOGvSO0",False,272820,
1326557341697839106,2020-11-11 16:08:11+00:00,"Today, we honor the service of those who have worn the uniform of the Armed Forces of the United States. 

To our proud veterans—I will be a commander in chief who respects your sacrifice, understands your service, and will never betray the values you fought so bravely to defend.",False,338758,
1326344141446373376,2020-11-11 02:01:00+00:00,We are going to build a health care system that puts you and your family first — and that every American can be proud of.,False,405173,
1326325015290273792,2020-11-11 00:45:00+00:00,"If you’re sick, if you’re struggling, if you’re worried about how you’re going to get through the day — we will not abandon you.

We will not leave you to face these challenges alone. https://t.co/eZUHaFE5bl",False,178941,
1326306141056364544,2020-11-10 23:30:00+00:00,"When I’m speaking to foreign leaders, I’m telling them: America is going to be back. We’re going to be back in the game.",False,589065,
1326284750420643846,2020-11-10 22:05:00+00:00,"Come January, we will work quickly with Congress to dramatically ramp up health care protections, get America to universal coverage, and lower health care costs.",False,282968,
1326279066140467201,2020-11-10 21:42:25+00:00,"RT @Transition46: Today, President-elect Joe Biden took part in separate congratulatory calls with the leaders of France, Germany, Ireland,…",False,0,
1326272198659645440,2020-11-10 21:15:07+00:00,Tune in as my campaign provides a post-election legal briefing. https://t.co/vApRDU8lTR,False,40039,
1326266378991542272,2020-11-10 20:52:00+00:00,"Beginning on January 20th, Vice President-elect Harris and I are going to do everything in our power to ease the burden of health care on you and your families.",False,413423,
1326245116462260224,2020-11-10 19:27:30+00:00,"Today, the Trump Administration is in court, attempting to eliminate the Affordable Care Act. Tune in as I discuss how my administration will expand access to quality, affordable health care. https://t.co/JB5uwBTKnd",False,69988,
1326214285949865986,2020-11-10 17:25:00+00:00,".@KamalaHarris and I aren’t wasting any time. We’re ready to get COVID-19 under control so that we can reopen our businesses and schools safely, resume our lives, and put this pandemic behind us. https://t.co/65C1XfR9rR",False,237651,
1325906004912037895,2020-11-09 21:00:00+00:00,"Let's get to work, @KamalaHarris. https://t.co/uYe2EsmaFa",False,393372,
1325890910635384839,2020-11-09 20:00:01+00:00,"I won't be president until January 20th, but my message today to everyone is this: wear a mask.",False,1406658,
1325885871875190784,2020-11-09 19:40:00+00:00,The bottom line: I will spare no effort to turn this pandemic around.,False,452451,
1325880083618426881,2020-11-09 19:17:00+00:00,"The challenge before us right now is still immense and growing, and so is the need for bold action to fight this pandemic.",False,229416,
1325873288711712769,2020-11-09 18:50:00+00:00,"My COVID-19 Transition Advisory Board will advise on detailed plans built on a bedrock of science, and that keep compassion, empathy, and care for every American at its core.",False,182920,
1325870017401905152,2020-11-09 18:37:00+00:00,"Today, I have named a COVID-19 Transition Advisory Board, comprised of distinguished public health experts, to help our transition team translate the Biden-Harris COVID-19 plan into a blueprint we can put into place as soon as @KamalaHarris and I are sworn into office.",False,324515,
1325842292444291072,2020-11-09 16:46:50+00:00,I spent the morning with the co-chairs of my COVID-19 Council discussing the status of this pandemic and how we move forward. Tune in as I provide an update on how we're going to beat this virus. https://t.co/VVGHZNnUFY,False,130339,
1325821740258365441,2020-11-09 15:25:10+00:00,RT @Transition46: Statement by President-elect Biden on Pfizer's vaccine progress: https://t.co/eOiLZnqO8N,False,0,
1325445063669936129,2020-11-08 14:28:23+00:00,"RT @Transition46: We stand together as one America. We will rise stronger than we were before.

https://t.co/97NKAZksSL https://t.co/PRvzyg…",False,0,
1325261759456874499,2020-11-08 02:20:00+00:00,From the bottom of my heart: thank you. https://t.co/s76oHFkr66,False,683146,
1325259242631274496,2020-11-08 02:10:00+00:00,"A nation united.

A nation strengthened.

A nation healed.

The United States of America.",False,869986,
1325258739318927361,2020-11-08 02:08:00+00:00,"With full hearts and steady hands, with faith in America and in each other, with a love of country — and a thirst for justice — let us be the nation that we know we can be.",False,590727,
1325257984562192385,2020-11-08 02:05:00+00:00,"Tonight, the whole world is watching America. I believe at our best America is a beacon for the globe.

And we lead not by the example of our power, but by the power of our example.",False,319802,
1325257229625421825,2020-11-08 02:02:00+00:00,"Especially for those moments when this campaign was at its lowest — the African American community stood up again for me. They always have my back, and I’ll have yours.",False,449900,
1325256474415800322,2020-11-08 01:59:00+00:00,"I believe that this is part of the mandate from the American people. They want us to cooperate.

That’s the choice I’ll make. And I call on the Congress — Democrats and Republicans alike — to make that choice with me.",False,134480,
1325255719336243200,2020-11-08 01:56:00+00:00,"Now that the campaign is over—what is the people’s will? What is our mandate?

I believe it is this: Americans have called on us to marshal the forces of decency and the forces of fairness. To marshal the forces of science and the forces of hope in the great battles of our time.",False,233876,
1325254964415881216,2020-11-08 01:53:00+00:00,"We cannot repair the economy, restore our vitality, or relish life’s most precious moments — hugging a grandchild, birthdays, weddings, graduations, all the moments that matter most to us — until we get this virus under control.",False,273026,
1325254461049073664,2020-11-08 01:51:00+00:00,"The Bible tells us that to everything there is a season — a time to build, a time to reap, a time to sow. And a time to heal.

This is the time to heal in America.",False,338643,
1325254209613123584,2020-11-08 01:50:00+00:00,"It’s time to put away the harsh rhetoric.

To lower the temperature.

To see each other again.

To listen to each other again.",False,244037,
1325253706061926401,2020-11-08 01:48:00+00:00,"To all those who volunteered, worked the polls in the middle of this pandemic, local election officials — you deserve a special thanks from this nation.",False,219837,
1325253454571270144,2020-11-08 01:47:00+00:00,"For America’s educators, this is a great day: You’re going to have one of your own in the White House, and Jill is going to make a great First Lady.",False,667081,
1325253203022241792,2020-11-08 01:46:00+00:00,"I pledge to be a President who seeks not to divide, but to unify.

Who doesn’t see Red and Blue states, but a United States.

And who will work with all my heart to win the confidence of the whole people.",False,295109,
1325252951124762625,2020-11-08 01:45:00+00:00,"Folks, the people of this nation have spoken.

They have delivered us a clear victory. A convincing victory.

A victory for “We the People.”",False,245938,
1325247969780621317,2020-11-08 01:25:12+00:00,A new day in America has come. Tune in as Vice President-Elect @KamalaHarris and I address the nation. https://t.co/d38F58DHu8,False,133893,
1325129452100100098,2020-11-07 17:34:15+00:00,"RT @KamalaHarris: We did it, @JoeBiden. https://t.co/oCgeylsjB4",False,0,
1325118992785223682,2020-11-07 16:52:42+00:00,"America, I’m honored that you have chosen me to lead our great country.

The work ahead of us will be hard, but I promise you this: I will be a President for all Americans — whether you voted for me or not.

I will keep the faith that you have placed in me. https://t.co/moA9qhmjn8",False,3111677,
1324926298762870785,2020-11-07 04:07:00+00:00,"We may be opponents — but we are not enemies. 

We are Americans.",False,1006380,
1324925795991609348,2020-11-07 04:05:00+00:00,We have to remember the purpose of our politics isn’t totally unrelenting warfare.,False,340931,
1324925040660393987,2020-11-07 04:02:00+00:00,"I know tensions can be high after a tough election like we just had.

But we need to remain calm. Patient. And let the process work out as we count all the votes.",False,348095,
1324924538749026306,2020-11-07 04:00:00+00:00,"We are going to be the first Democrats to win Arizona in 24 years.

We are going to be the first Democrats to win Georgia in 28 years.

And we re-built the Blue Wall in the middle of the country that crumbled just four years ago.",False,316138,
1324924285631176704,2020-11-07 03:59:00+00:00,"What is becoming clearer each hour is that record numbers of Americans — from all races, faiths, regions — chose change over more of the same. 

They have given us a mandate for action on COVID and the economy and climate change and systemic racism.",False,208233,
1324923025138049027,2020-11-07 03:53:59+00:00,The numbers tell us a clear and convincing story: We're going to win this race.,False,781369,
1324921258845204480,2020-11-07 03:46:58+00:00,Tune in as I address the nation on the current state of the race. https://t.co/w0er4issEk,False,88949,
1324531952230289408,2020-11-06 02:00:00+00:00,"Donald Trump is going to court to stop votes from being counted. We have assembled the largest election protection effort in history to fight back and need your help.

Chip in to make sure every vote is counted: https://t.co/ksrwxu9nDE",False,210869,
1324521884394921985,2020-11-06 01:20:00+00:00,"Keep the faith, folks.",False,905038,
1324511817658441728,2020-11-06 00:40:00+00:00,"No one is going to take our democracy away from us. Not now, not ever.

America has come too far, fought too many battles, and endured too much to let that happen.",False,537115,
1324490426649317376,2020-11-05 23:15:00+00:00,"The people will not be silenced, be bullied, or surrender.

Every vote must be counted.",False,529979,
1324469173297303552,2020-11-05 21:50:33+00:00,I spent the afternoon attending briefings on the ongoing COVID-19 crisis and the state of the economy. Tune in as I provide an update on these briefings and efforts to count every vote. https://t.co/duoDWfzf5C,False,134759,
1324467777470558208,2020-11-05 21:45:00+00:00,"I ask people to stay calm. 
The process is working. 
The count is being completed.",False,527202,
1324465078243151885,2020-11-05 21:34:16+00:00,"Democracy is sometimes messy, so sometimes it requires a little patience. 

But that patience has been rewarded now for more than 240 years with a system of governance that has been the envy of the world.",False,266413,
1324445128434438145,2020-11-05 20:15:00+00:00,We’re fighting to ensure every last vote is counted across the country — and we need your help to do it. Chip in to the Biden Fight Fund to fuel our election protection efforts: https://t.co/VsuxvtqAFa,False,75733,
1324430028860493826,2020-11-05 19:15:00+00:00,"Let me be clear: I campaigned as a proud Democrat, but I will govern as an American president. https://t.co/Mv5hHI2Rb3",False,370223,
1324406121721786369,2020-11-05 17:40:00+00:00,"Be patient, folks. Votes are being counted, and we feel good about where we are.",False,851884,
1324384344962592769,2020-11-05 16:13:28+00:00,"As votes continue to be counted across the country, tune in as my campaign manager @jomalleydillon and campaign adviser Bob Bauer give an update on where things stand. https://t.co/sKReFhHU5j",False,53661,
1324341948568621056,2020-11-05 13:25:00+00:00,Every vote must be counted. https://t.co/kWLGRfeePK,False,216653,
1324187178688196609,2020-11-05 03:10:00+00:00,"Donald Trump does not decide the outcome of this election and nor do I. The American people decide. That’s why we’ve launched the Biden Fight Fund — to ensure every vote is counted.

Chip in to help fund our election protection efforts across the country: https://t.co/ps6VhGy0m5",False,148627,
1324179628932562944,2020-11-05 02:40:00+00:00,"I’m confident that we will emerge victorious.

But this will not be my victory alone.

It will be a victory for the American people. https://t.co/ZqJBVsQuQf",False,230945,
1324172079025934336,2020-11-05 02:10:00+00:00,"It’s clear that when the count is finished, we believe we will be the winners. https://t.co/qVk0igZlrF",False,256206,
1324158992877154310,2020-11-05 01:18:00+00:00,"Today, the Trump Administration officially left the Paris Climate Agreement. And in exactly 77 days, a Biden Administration will rejoin it. https://t.co/L8UJimS6v2",False,725045,
1324136846826364929,2020-11-04 23:50:00+00:00,"Keep faith in the process and in each other. Together, we will win this.",False,654646,
1324115456190459911,2020-11-04 22:25:00+00:00,"I am confident we will emerge victorious, but this will not be my victory or our victory alone. It will be a victory for the American people, for our democracy, for America.",False,492534,
1324112939310264322,2020-11-04 22:15:00+00:00,"To make progress, we have to stop treating our opponents as enemies. We are not enemies.",False,592746,
1324110423411490816,2020-11-04 22:05:00+00:00,"Once this election is finalized and behind us, it will be time for us to do what we've always done as Americans: To put the harsh rhetoric of the campaign behind us.",False,277561,
1324107906246086656,2020-11-04 21:55:00+00:00,"Every vote must be counted. No one is going to take our democracy away from us, not now, not ever.",False,473604,
1324105390049488896,2020-11-04 21:45:00+00:00,"The presidency, itself, is not a partisan institution. It's the one office in the nation that represents everyone and it demands a duty of care for all Americans, and that is precisely what I will do.",False,264907,
1324103124768882689,2020-11-04 21:36:00+00:00,"Power can't be taken or asserted, it flows from the people, and it's their will that determines who will be the President of the United States.",False,495001,
1324095643116163072,2020-11-04 21:06:16+00:00,Tune in as I address the nation on the state of the race. https://t.co/00QtuYAiI7,False,84272,
1324066382846320641,2020-11-04 19:10:00+00:00,Count every vote.,False,1087105,
1324062214412767232,2020-11-04 18:53:26+00:00,RT @TeamJoe: Here are the facts... https://t.co/UgZ5bDqLU2,False,0,
1324057905667149826,2020-11-04 18:36:19+00:00,"To make sure every vote is counted, we’re setting up the largest election protection effort ever assembled. Because Donald Trump doesn’t get to decide the outcome of this election — the American people do.

Chip in to power the new Biden Fight Fund: https://t.co/1hCoKB0QfP",False,179292,
1324006410745569282,2020-11-04 15:11:41+00:00,We won't rest until everyone's vote is counted. Tune in as my campaign manager @jomalleydillon and campaign adviser Bob Bauer give an update on where the race stands. https://t.co/Rwz4iR25B3,False,101507,
1323868327744253952,2020-11-04 06:03:00+00:00,We feel good about where we are. We believe we are on track to win this election.,False,641242,
1323867320826109954,2020-11-04 05:59:00+00:00,It's not my place or Donald Trump's place to declare the winner of this election. It's the voters' place.,False,701849,
1323865811031785472,2020-11-04 05:53:00+00:00,"Keep the faith, guys. We’re gonna win this.",False,1801272,
1323862422084493312,2020-11-04 05:39:32+00:00,"Tune in as I speak to the nation live from Wilmington, Delaware. https://t.co/ye8knRucoz",False,60230,
1323813103012818946,2020-11-04 02:23:33+00:00,"RT @TeamJoe: CONDADO DE CLARK, NV 🚨 En algunos lugares, el horario de votación se ha extendido UNA hora hasta las 8 PM. Si estás en la fila…",False,0,
1323813088102146049,2020-11-04 02:23:30+00:00,"RT @TeamJoe: 🚨 CLARK COUNTY, NV 🚨 Polling hours have been extended in some locations by ONE hour to 8PM. If you’re in line by 8PM you can s…",False,0,
1323810798129610762,2020-11-04 02:14:24+00:00,"RT @TeamJoe: 🚨 EL CONDADO DE MARICOPA 🚨 ¿Estás en fila para votar?, quédate ahí. Si llegaste a la fila antes de las 7PM, ¡tienes garantizad…",False,0,
1323803877838364672,2020-11-04 01:46:54+00:00,"RT @TeamJoe: 🚨 MARICOPA COUNTY 🚨 waiting in line to vote? Stay put — if you’re in line before 7 PM, you are guaranteed your right to vote!…",False,0,
1323790702577373184,2020-11-04 00:54:32+00:00,"RT @TeamJoe: New Hampshire, if you are waiting at the polls — stay in line! If you’re in line, you are guaranteed your right to vote. RT to…",False,0,
1323788300176388096,2020-11-04 00:45:00+00:00,"Stay in line, folks.",False,689706,
1323770935728607237,2020-11-03 23:36:00+00:00,"As polls begin to close in certain parts of the country, remember to stay in line. 

If you’re in line at your polling place before it closes, you’re able to vote. https://t.co/qUpn30B8mj",False,108896,
1323761880234553346,2020-11-03 23:00:01+00:00,"Folks, time is running out to make your voice heard in this election. If you haven’t voted yet, go to https://t.co/EcbUdX2aPs to find your polling place and head there as soon as you can.",False,36040,
1323753975221522433,2020-11-03 22:28:36+00:00,"This is our moment to prove that:

Love is more powerful than hate.
Hope is more powerful than fear.
Light is more powerful than dark.

Vote before polls close: https://t.co/eoxT07d7QB",False,178165,
1323747783732535300,2020-11-03 22:04:00+00:00,"Let's win this thing, Pennsylvania! https://t.co/jmCXbuL5V3",False,189767,
1323739479069392904,2020-11-03 21:31:00+00:00,"Who we are. What we stand for. Who we are going to be.

It's all at stake — and you have the power to determine the outcome.

Vote before polls close: https://t.co/eoxT07d7QB https://t.co/hmv0MGtr5P",False,52407,
1323731677202567169,2020-11-03 21:00:00+00:00,"Today is your absolute last chance to vote in this election. If you haven’t voted early, I need you to vote today and stay in line as long as it takes. Our democracy is at stake. Go to https://t.co/EcbUdXjMe2 to find your polling location. https://t.co/igwKdFba98",False,32656,
1323728652148891651,2020-11-03 20:47:59+00:00,"RT @KamalaHarris: ☎️ 1 (833) 336-8683 ☎️ 

If you have any questions or concerns about voting, call our hotline. Our team of volunteers are…",False,0,
1323727125380288513,2020-11-03 20:41:55+00:00,"RT @BarackObama: This Election Day, everything is on the line. Our jobs. Our health care. Whether or not we get this pandemic under control…",False,0,
1323725896017203207,2020-11-03 20:37:01+00:00,"RT @realGpad: Despite what we’re still going through after 9 months, Trump continues to diminish the pain felt by so many who have lost lov…",False,0,
1323722695297695745,2020-11-03 20:24:18+00:00,"This is our moment to choose:

Hope over fear.
Unity over division.
Science over fiction.
Truth over lies.

Vote: https://t.co/eoxT07d7QB",False,146909,
