id_str,created_at,text,retweeted,favorite_count,in_reply_to_screen_name
1563302019032846336,2022-08-26 23:07:00+00:00,"Senator Rick Scott wrote the only election-year plan the GOP has this year—in it, he wants to require Congress to vote on the future of Social Security every 5 years.

Do you want to put your Social Security into the hands of Ted Cruz or Marjorie Taylor Greene?",False,31054,
1563283902898114562,2022-08-26 21:55:01+00:00,"Under my student debt relief plan, almost 90% of the benefit will go to folks making less than $75,000 a year.",False,17522,
1563237850115878917,2022-08-26 18:52:01+00:00,"10 million jobs—more than ever created before at this point of a presidency. 
3.5% unemployment rate—a near record low in the history of this country. 
More than 220 million Americans were vaccinated. 
Record small business creation. 

That’s our economic record.",False,9865,
1563213196348993542,2022-08-26 17:14:03+00:00,"Every Republican in Congress voted against lower prescription drug prices.
 
Against lower health care costs.
Against a fairer tax system.
Against tackling the climate crisis.
Against lowering your energy costs.
Against creating good-paying jobs.

They chose the already-powerful.",False,12850,
1562955005228765186,2022-08-26 00:08:06+00:00,"Wall Street didn’t build this country. You did. The working people—the middle class—built this nation. And unions built the middle class.

We won’t let anyone or anything tear America apart.",False,23208,
1562953391441334275,2022-08-26 00:01:41+00:00,"Every election is a choice. My dad used to say: “Don’t compare me to the Almighty. Compare me to the alternative.”

Well, the alternative to the Democrats is the MAGA Republicans.",False,77832,
1562953001710788611,2022-08-26 00:00:08+00:00,"Every single Republican voted against:
❌ Lowering prescription drug prices
❌ Lower health care costs
❌ Tackling the climate crisis
❌ Lower energy costs
❌ Creating good-paying jobs
❌ A fairer tax system",False,28291,
1562951850357583872,2022-08-25 23:55:34+00:00,"We had to take on the big drug companies to pass the Inflation Reduction Act.

For decades, Big Pharma fought to block giving Medicare the power to negotiate for lower prices.

And, for decades, Big Pharma won.

Not this year. The American people won. And big pharma lost.",False,8813,
1562950578296147968,2022-08-25 23:50:30+00:00,"In 2020, 81 million Americans voted to save our democracy.

That’s why Donald Trump isn’t just a former president. He’s a defeated former president.

Now, you need to vote to save democracy again.",False,70129,
1562948265040945154,2022-08-25 23:41:19+00:00,"In Maryland to discuss what’s at stake in this election and how we will continue to deliver for the American people. Tune in now.
https://t.co/hhDR6fnS10",False,3029,
1562914214981029890,2022-08-25 21:26:01+00:00,"Yesterday, we put out a plan to bring relief to millions of working and middle-class people with student loans.

We’re keeping my campaign promise and forgiving up to $10,000 of federal student loan debt for individuals making less than $125,000 a year.",False,14927,
1562863634715357185,2022-08-25 18:05:01+00:00,"The Inflation Reduction Act is a loss for Big Pharma. 

This is a win for the American people—for you.",False,13354,
1562601957633560576,2022-08-25 00:45:13+00:00,"My plan to address student loan debt is responsible, fair, and focuses the benefit on middle-class and working families. https://t.co/IVp95AfuYW",False,9128,
1562586862510014464,2022-08-24 23:45:14+00:00,I will never apologize for helping working Americans and the middle-class. https://t.co/tZ9HTu744j,False,21758,
1562578252614361088,2022-08-24 23:11:01+00:00,"Today, we’re meeting my campaign commitment with targeted debt relief to folks from families who need it most. 

If you received a Pell Grant while in college and make less than $125,000 a year, you are eligible for up to $20,000 in debt reduction. https://t.co/1soacSBajg",False,8904,
1562463641806311426,2022-08-24 15:35:36+00:00,"RT @POTUS: In keeping with my campaign promise, my Administration is announcing a plan to give working and middle class families breathing…",False,0,
1562172072419278849,2022-08-23 20:17:00+00:00,"We'll no longer have a situation where 55 of the largest corporations in America pay zero in federal income taxes on $40 billion in profits thanks to the Inflation Reduction Act.

And no one making less than $400,000 per year will pay a penny more in federal taxes.",False,21816,
1562143637797994504,2022-08-23 18:24:01+00:00,"The Inflation Reduction Act caps insulin prices for Medicare recipients at $35 for a month's supply. 

It's a game changer.",False,23773,
1561844164282798085,2022-08-22 22:34:01+00:00,"In this historic moment, Democrats sided with the American people—and every single Republican in the Congress sided with the special interests. 
https://t.co/NblX0IhwKR",False,10803,
1561764137667026945,2022-08-22 17:16:01+00:00,"The Inflation Reduction Act will reduce the deficit without raising a penny in taxes on people making under $400,000 a year.",False,18262,
1561485800600125442,2022-08-21 22:50:00+00:00,"Today, there are more people working in America than before the pandemic began. In fact, there are more people working in America than at any point in American history.",False,26139,
1561443523131580416,2022-08-21 20:02:00+00:00,I remember sitting at my mom and dad’s dining room table and watching them choose which bills they were going to pay that month because there wasn’t enough money to pay all of them. That’s why I’m doing everything in my power to lower costs for families.,False,56647,
1561400742040088577,2022-08-21 17:12:00+00:00,"The Inflation Reduction Act caps out-of-pocket expenses for prescription drug prices at no more than $2,000 a year for Medicare recipients.",False,12914,
1561121650900455426,2022-08-20 22:43:00+00:00,"Let's be clear: At this historic moment, Democrats sided with the American people, and every single Republican in Congress sided with special interests.

https://t.co/ll2x4Nc7Kj",False,21012,
1561086670744817669,2022-08-20 20:24:00+00:00,"From the fundamental right to privacy to the benefits we depend on, like Social Security and Medicare—so much is at risk in this midterm election.

With 80 days until Election Day, check your voter registration: https://t.co/Hy8C4mIL2M",False,5153,
1561033320431075328,2022-08-20 16:52:00+00:00,The midterms will be here before we know it. Join me and @DrBiden in Maryland for a grassroots event to hear what's at stake in this election and how we will continue to deliver for the American people. RSVP today: https://t.co/vP1YSEVJE4,False,4283,
1560990110883127303,2022-08-20 14:00:18+00:00,"Two years ago, I accepted the Democratic Party’s nomination for president.

I'm incredibly grateful for the trust you have put in me and @KamalaHarris. Since then, we've made historic infrastructure investments, achieved record job growth, and began rebuilding our economy. https://t.co/Q1dKniGpLq",False,19511,
1560755998826156033,2022-08-19 22:30:02+00:00,"The Inflation Reduction Act is the biggest step forward on climate ever.  

It includes ensuring that we create clean energy opportunities in frontline and fenceline communities that have been smothered by legacy pollution and it will help fight environmental injustice.",False,9990,
1560700880156065795,2022-08-19 18:51:00+00:00,We're seeing a stronger labor market where jobs are booming and more Americans are working than ever in history. That's what happens when you build an economy from the bottom up and the middle out—it gives everyone a chance to get ahead.,False,14029,
1560673954225950721,2022-08-19 17:04:01+00:00,"We passed the Inflation Reduction Act while keeping my campaign commitment: No one earning less than $400,000 a year will pay a single penny more in federal taxes.",False,33171,
1560413988608933888,2022-08-18 23:51:00+00:00,"Every single Republican who voted against the Inflation Reduction Act voted against:

— Lower prescription drug prices
— Lower health care costs
— A fairer tax system
— Tackling the climate crisis
— Lowering energy costs
— Creating good-paying jobs",False,27370,
1560314345879470080,2022-08-18 17:15:03+00:00,"Democrats voted to cut the deficit to fight inflation by having the wealthy and big corporations pay their fair share. Every single Republican opposed requiring big corporations to pay a minimum tax of 15%, instead of some getting away with paying $0 in federal income taxes.",False,13884,
1560032726459236352,2022-08-17 22:36:00+00:00,"Thanks to the Inflation Reduction Act, we are giving Medicare the power to negotiate for lower prescription drug prices. 

Despite big drug companies spending millions to beat this law, we prevailed.",False,12093,
1559984662369505281,2022-08-17 19:25:01+00:00,The Inflation Reduction Act will take the most aggressive action ever to confront the climate crisis and strengthen our energy security.,False,16950,
1559938147215179776,2022-08-17 16:20:11+00:00,The Inflation Reduction Act is one of the most significant laws in our history. The American people won and the special interests lost. https://t.co/pXlnmnWNYU,False,11997,
1559631898619641857,2022-08-16 20:03:15+00:00,"The Inflation Reduction Act will help save money on prescription drugs, cut health care premiums, cut energy costs, take aggressive action on climate, and make large corporations pay their fair share in taxes.

We got it done. https://t.co/XjdkNkOpov",False,14858,
1559563157638610952,2022-08-16 15:30:06+00:00,"RT @POTUS: For millions, hearing aids and the doctor’s visit to get them are too expensive. That's why I called on the FDA to make them ava…",False,0,
1559543003152277507,2022-08-16 14:10:01+00:00,"Democrats sided with the American people with the Inflation Reduction Act, and the Republicans sided with special interests. 

That's the choice we face: Whether we protect the already powerful or have the courage to build a future where everybody has an even shot.",False,15811,
1559338652400074754,2022-08-16 00:38:00+00:00,"Thanks to the Inflation Reduction Act, America is going to take the most aggressive action we’ve ever taken in confronting the climate crisis and strengthening the energy security of America and the world.",False,25414,
1559291843757723649,2022-08-15 21:32:00+00:00,"With the final passage of the Inflation Reduction Act, the American people are going to see lower prescription drug prices, lower health care costs, and lower energy costs, and big corporations are finally going to start to pay their fair share.",False,17703,
1558498114515910656,2022-08-13 16:58:00+00:00,"RT @POTUS: With the passage of the Inflation Reduction Act, House Democrats chose to build a future where everybody has a shot, not just th…",False,0,
1558213528342913025,2022-08-12 22:07:10+00:00,"RT @POTUS: Today, the American people won. Special interests lost.

With the passage of the Inflation Reduction Act in the House, families…",False,0,
1557841286987751429,2022-08-11 21:28:00+00:00,"The PACT Act will mean new facilities, improved care, and retention of health care workers treating veterans. This new law matters.",False,13360,
1557784664571527168,2022-08-11 17:43:00+00:00,A key driver of our economic recovery is the resurgence of America's small businesses. We learned recently that small businesses with less than 50 employees created nearly 3 million jobs in 2021—the most ever in a single year.,False,9720,
1557744912875114497,2022-08-11 15:05:03+00:00,"I was proud then, and I'm even prouder to serve with you now, @KamalaHarris. https://t.co/Mhxm2pS4GE",False,11471,
1557728662015082498,2022-08-11 14:00:28+00:00,It's been two years since I announced @KamalaHarris as my running mate. She’s a fearless fighter and the best partner I could have for the work ahead. https://t.co/BZxx5Nd7EQ,False,61847,
1557487457641402377,2022-08-10 22:02:01+00:00,"Today, we're one step closer to fulfilling our sacred obligation with the PACT Act, the most significant law our nation has passed to help millions of veterans who are exposed to toxic substances during their military services.",False,11641,
1557464360934580224,2022-08-10 20:30:14+00:00,I will always fight for the care and benefits veterans have more than earned and deserve. https://t.co/bgpRc0hPfH,False,56211,
1557383032817975296,2022-08-10 15:07:04+00:00,"In just 90 days, voters must choose between ultra-MAGA Republicans who are attacking our freedoms, and Democrats who are fighting to defend them.

Make sure you're registered to vote: https://t.co/Hy8C4mIL2M",False,9938,
1557372450584788994,2022-08-10 14:25:01+00:00,RT @POTUS: The PACT Act is the most significant law in our nation’s history to help millions of veterans who were exposed to toxic substanc…,False,0,
1557140669600333826,2022-08-09 23:04:00+00:00,"One of the ways we’re giving working people a fighting chance is by making health care, prescriptions, energy, and so much more affordable and accessible through the Inflation Reduction Act.",False,13811,
1557106497825505280,2022-08-09 20:48:13+00:00,"Today, I signed the CHIPS and Science Act into law, a once-in-a-generation investment in America itself.

A law the American people can be proud of. https://t.co/sS5bGkNQkV",False,12765,
1557045548007542784,2022-08-09 16:46:01+00:00,"The Inflation Reduction Act caps seniors’ out of pocket spending for prescription drugs at $2,000 per year.",False,18372,
1556772997804982272,2022-08-08 22:43:00+00:00,"The Inflation Reduction Act makes the largest investment ever in combating climate change.

It addresses the climate crisis and strengthens our energy security, creating jobs manufacturing solar panels, wind turbines, and electric vehicles in America with American workers.",False,8133,
1556739543637917697,2022-08-08 20:30:04+00:00,"Let me be clear:

We're going to invest in America. 
We're going to make it in America. 
We're going to win the economic competition of the 21st century in America.",False,20309,
1556724932456972288,2022-08-08 19:32:01+00:00,"RT @POTUS: To the people of Kentucky: Jill and I want you to know that the country is with you.

We’re praying for the families of those wh…",False,0,
1556713105958240258,2022-08-08 18:45:01+00:00,"I ran for president promising to make government work for working families again, and that is what the Inflation Reduction Act does—period.",False,34157,
1556386287090819075,2022-08-07 21:06:21+00:00,"Today, Senate Democrats passed the Inflation Reduction Act, siding with American families over special interests, voting to lower the cost of prescription drugs, health insurance, and energy and reduce the deficit while making the wealthiest corporations pay their fair share.",False,34061,
1556058538899755008,2022-08-06 23:24:00+00:00,"The CHIPS Act will supercharge our efforts to make semiconductors here in America. It will make cars, appliances, and computers cheaper and lower the costs of everyday goods. And, it will create high-paying manufacturing jobs across the country.",False,18395,
1556004693746253824,2022-08-06 19:50:02+00:00,"The PACT Act is the biggest expansion of VA health care in decades, and the largest single bill ever to comprehensively address exposure to burn pits.

I look forward to signing this bill, so veterans and their families get the benefits and health care they earned and deserve.",False,10709,
1555951584856662016,2022-08-06 16:19:00+00:00,"The voters of Kansas sent a powerful signal that this fall, the American people will vote to preserve and protect their rights and refuse to let them be ripped away by politicians. 

We have your back.",False,18563,
1555685582206124032,2022-08-05 22:42:00+00:00,"This week, I signed an executive order to make sure health care providers comply with federal law, so women don't face delays or denials of medically necessary care. 

It builds on the first one I signed last month that will also help safeguard access to health care.",False,12457,
1555629772629213190,2022-08-05 19:00:14+00:00,"We’ve taken another step toward reducing inflation and costs for America’s families. 

The Inflation Reduction Act would help save money on prescription drugs, health premiums, and much more. It will not raise taxes on those making less than $400,000.",False,9648,
1555576887694561280,2022-08-05 15:30:05+00:00,"The unemployment rate now matches the lowest it’s been in more than 50 years: 3.5%. 

More people are working than at any point in American history, and it’s the result of my economic plan to build the economy from the bottom up and middle out.",False,27724,
1555342858114269189,2022-08-05 00:00:08+00:00,More than 35 million Americans are enrolled in Affordable Care Act related coverage—the highest on record.,False,21180,
1555303061186379776,2022-08-04 21:22:00+00:00,"Voters in Kansas rejected extreme efforts to amend the state constitution to take away a woman’s right to choose. 

This vote makes clear what we know: The majority of Americans agree that women should have access to abortion and the right to make their own health care decisions.",False,12787,
1554642279838670848,2022-08-03 01:36:18+00:00,"The bipartisan PACT Act is the biggest expansion of benefits for service-connected health issues in 30 years. Millions of veterans who may have been exposed to harmful toxins will have quicker access to health care services and benefits. 

I look forward to signing this bill.",False,21192,
1554638367861755905,2022-08-03 01:20:45+00:00,"RT @POTUS: Congress has passed the PACT Act, a critical step towards fulfilling our sacred obligation to care for our veterans and their fa…",False,0,
1554568228550180869,2022-08-02 20:42:02+00:00,"126 economists wrote that the Inflation Reduction Act would lower costs for families, set the stage for strong economic growth, and tackle the climate crisis. 

Send it to my desk. https://t.co/nZpIpBFgj7",False,11652,
1554250434403090434,2022-08-01 23:39:14+00:00,RT @POTUS: I’m addressing the nation on a successful counterterrorism operation. https://t.co/SgTVaszA3s,False,0,
1553510421709086722,2022-07-30 22:38:42+00:00,"RT @POTUS: Folks, today I tested positive for COVID again. 
 
This happens with a small minority of folks. 
 
I’ve got no symptoms but I am…",False,0,
1553433797802315778,2022-07-30 17:34:13+00:00,"RT @POTUS: Fifty-seven years ago, Medicare became law. And for 57 years, Republicans on the Hill have fought it. Including Senator Scott wh…",False,0,
1553426194326077440,2022-07-30 17:04:00+00:00,"While COVID is still with us, our fight against this virus is making a difference. We can now protect ourselves from serious illness due to COVID, and COVID deaths are down nearly 90%.",False,16060,
1553120735018745857,2022-07-29 20:50:13+00:00,"These COVID tools are free, convenient, safe, and they work. https://t.co/Y63EqER9b5",False,6822,
1553066076509970432,2022-07-29 17:13:01+00:00,"Let me be clear:

The Inflation Reduction Act would be the most significant legislation in history to tackle the climate crisis and improve our energy security right away. 

Let's pass it for the American people.",False,19209,
1553025076097957890,2022-07-29 14:30:06+00:00,"By making more semiconductors in the United States, the CHIPS and Science Act will increase domestic manufacturing and lower costs for families.

I look forward to signing this bill into law and continuing to grow our economy for working families across the country.",False,13558,
1552804598519398401,2022-07-28 23:54:00+00:00,"The Inflation Reduction Act would lower health care costs for millions of Americans, and it would be the most important investment we've made in energy security and creating clean energy solutions for the future.

It's a big deal.",False,21400,
1552760922732695552,2022-07-28 21:00:27+00:00,"My message to Congress is this:

The Inflation Reduction Act is the strongest bill you can pass. It will lower inflation, cut the deficit, reduce health care costs, tackle the climate crisis, and promote energy security. https://t.co/YtF1h7G7R5",False,9838,
1552062206761746433,2022-07-26 22:44:00+00:00,Brave women and men in uniform across America should never forget that the defeated former president of the United States watched January 6 happen and didn’t have the spine to act.,False,71355,
1551993265473323010,2022-07-26 18:10:03+00:00,"You can’t be pro-insurrection and pro-cop. 
You can’t be pro-insurrection and pro-democracy. 
You can’t be pro-insurrection and pro-American.
https://t.co/DCHprpK9Sx",False,45256,
1551279297851269122,2022-07-24 18:53:00+00:00,"I grew up in a family where if the price of gas went up, we felt it.

Gas prices have dropped since mid-June and should continue to come down in the days and weeks ahead. I know those extra dollars and cents mean something.",False,30136,
1550966738019287041,2022-07-23 22:11:00+00:00,"With oil prices coming down 20% from June highs, it's unacceptable that prices at the pump have only come down by half as much.

It's time for oil and gas companies to pass these lower costs on to Americans.",False,35468,
1550896273250832385,2022-07-23 17:31:00+00:00,"Americans have seen gas prices drop by about 60 cents a gallon in the last month, saving the average driver about $30/month.

An extra 60 cents a gallon back in your pocket is meaningful. It's breathing room. 

And we're not done working to lower costs for families.",False,21503,
1550154110279753728,2022-07-21 16:21:55+00:00,"RT @POTUS: Folks, I'm doing great. Thanks for your concern. Just called Senator Casey, Congressman Cartwright, and Mayor Cognetti (and my S…",False,0,
1547993400653123585,2022-07-15 17:16:01+00:00,"The price of oil is down about 20% since mid-June, but the price of gas has so far only fallen half as much. 

Oil and gas companies must not use this moment as an excuse for profiting by not passing along savings at the pump.",False,31626,
1547551959686725634,2022-07-14 12:01:53+00:00,"The Supreme Court’s decision on Dobbs was received by Republicans in Congress as a green light to go further and try to ban abortion nationwide. 

The choice is clear: We must elect Democrats in November. https://t.co/Gl7b3KIAZy",False,6996,
1547269203987763200,2022-07-13 17:18:19+00:00,"Make no mistake: The Bipartisan Safer Communities Act is real progress, but more has to be done. https://t.co/lpKTdsTM33",False,6744,
1546923404586000384,2022-07-12 18:24:14+00:00,"There can be no greater responsibility than to do all we can to ensure the safety of our families, our children, and our fellow Americans. https://t.co/HsT6qFNDwu",False,7725,
1546872262661382147,2022-07-12 15:01:01+00:00,"RT @POTUS: My team and I have been monitoring the BA.5 variant of COVID-19 for months. We're prepared, and we know how to manage this momen…",False,0,
1546658176627625986,2022-07-12 00:50:19+00:00,"Make no mistake: The Bipartisan Safer Communities Act is real progress, but more has to be done. https://t.co/7cVhPoTCG1",False,5773,
1546653067290021888,2022-07-12 00:30:01+00:00,"The Bipartisan Safer Communities Act closes the ""boyfriend loophole,"" so if you are convicted of assault against a dating partner, you cannot buy a gun.

​​If we keep guns out of the hands of domestic abusers, we can save the lives of their partners and stop more mass shootings.",False,14343,
1546639792015904774,2022-07-11 23:37:16+00:00,"The action we take today on gun violence is a step designed to make our nation the kind of nation it should be.
 
It's about the most fundamental things: the lives of our children and our loved ones. https://t.co/GRL2KhBDcA",False,5144,
1546539063829839872,2022-07-11 16:57:00+00:00,"Republicans voted against protecting retirement and pensions, but had no problem passing a $2T tax cut that benefited the wealthiest Americans. They choose to make life more comfortable for the ultra-rich while opposing retirement security for working people.",False,32848,
1546260478564962306,2022-07-10 22:30:00+00:00,"Republicans are doing nothing but obstructing our efforts to crack down on gas-price gouging, lower food prices, lower healthcare costs, and hopefully, soon, lower your prescription drug costs. 

This is not right. And that’s why this election is going to be so darn important.",False,38675,
1546176483693133824,2022-07-10 16:56:14+00:00,"Last week, I had the honor of recognizing an extraordinary group of Americans with the Presidential Medal of Freedom—our nation's highest civilian award. 

These individuals are all working to ensure the idea of America shines like the sun to light up the future of the world. https://t.co/K0CpmUtKYs",False,6672,
1546161324442402816,2022-07-10 15:56:00+00:00,"We’ve seen the risk millions of workers face as they watch their pensions turn into broken promises. Now that we are implementing the Special Financial Assistance program, millions of workers will have the retirement they earned.

Zero Republicans voted for this legislation.",False,15910,
1545821338790764545,2022-07-09 17:25:01+00:00,"This week, I was proud to award the Medal of Honor to four soldiers who performed acts of incredible heroism during the Vietnam War. 

They stood in the way of danger and risked everything to defend our nation, and they are finally getting the recognition they deserve. https://t.co/g0H0T9BEnT",False,10953,
1545808322384764928,2022-07-09 16:33:18+00:00,This is why elections matter. https://t.co/KW3nENBtgr,False,14549,
1545771851355459584,2022-07-09 14:08:23+00:00,"The Court and its allies are committed to moving America backwards with fewer rights, less autonomy, and politicians invading the most personal decisions. https://t.co/j4B29jRnpo",False,8301,
