id_str,created_at,text,retweeted,favorite_count,in_reply_to_screen_name
1400145643881091072,2021-06-02 17:41:49+00:00,Congratulations to Congresswoman-elect @MelanieforNM on your victory last night. Your grit and determination will help deliver real results for all New Mexicans. #NM01 is in good hands.,False,19731,
1399734647463071745,2021-06-01 14:28:40+00:00,"RT @POTUS: 100 years ago, the thriving Black community of Greenwood in Tulsa, Oklahoma was ruthlessly attacked by a white supremacist mob—a…",False,0,
1399444224102305792,2021-05-31 19:14:38+00:00,"RT @POTUS: On Memorial Day, we honor and reflect upon the courage, integrity, and selfless dedication of the members of our Armed Forces wh…",False,0,
1399370630039052292,2021-05-31 14:22:11+00:00,RT @POTUS: Tune in as we honor our fallen heroes at the 153rd National Memorial Day Observance. https://t.co/p9DJ1LparL,False,0,
1398663242675806212,2021-05-29 15:31:17+00:00,"Grassroots supporters made it possible for us to pass the American Rescue Plan and start getting our country back on track—but our work is far from over. Please consider chipping in to support Democrats running for office in 2021, 2022, and beyond.
https://t.co/XfbPPFvKr8",False,8243,
1398385137402843137,2021-05-28 21:06:12+00:00,"Before we took office, the economy added back 60,000 jobs per month. It’s now adding back 500,000 jobs per month.

In fact, we've created 1.5 million jobs—more jobs than have ever been created in the first three months of any president in our nation's history.",False,63140,
1398335999349035012,2021-05-28 17:50:56+00:00,"To put it simply, America's coming back. https://t.co/SYN7NZkH91",False,16813,
1398293173349277704,2021-05-28 15:00:46+00:00,RT @POTUS: America is on the move again. We’ve turned the tide on a once-in-a-century pandemic and a once-in-a-generation economic crisis.…,False,0,
1398083579075350528,2021-05-28 01:07:55+00:00,"This is our moment to rebuild an economy from the bottom up and the middle out—not trickle down.

This is our moment to rebuild an economy that rewards work, not just wealth.

This is our moment to rebuild an economy that works for the backbone of this country.",False,42618,
1398039819947741185,2021-05-27 22:14:02+00:00,The Biden economic plan is working. https://t.co/boXNRUWEvi,False,15640,
1397980959723696137,2021-05-27 18:20:08+00:00,RT @POTUS: Tune in as I deliver remarks on our economic progress and share my vision for the future. https://t.co/h5ULW6rjJ7,False,0,
1397694754528313350,2021-05-26 23:22:52+00:00,"RT @POTUS: We are still awaiting many of the details of this latest mass shooting in San Jose, but there are some things we know for sure.…",False,0,
1397655816426119173,2021-05-26 20:48:08+00:00,"Enjoyed meeting with Maria and Dreamers this month. Dreamers are Americans, and we are fighting for them. https://t.co/3Hfa0xNnFN",False,10857,
1397297809410433027,2021-05-25 21:05:32+00:00,"Across the country, we have failed to properly invest in infrastructure for half a century. The American Jobs Plan will get millions of Americans good-paying union jobs repairing our country’s crumbling infrastructure.

It’s a blue-collar blueprint to rebuild America.",False,38336,
1397249167286841347,2021-05-25 17:52:15+00:00,"RT @POTUS: It’s been one year since George Floyd was murdered. In that time, George’s family has shown extraordinary courage. Last month’s…",False,0,
1396938703109492741,2021-05-24 21:18:35+00:00,"After meeting with experts and scientists, our administration has set an ambitious goal of having 70% of the U.S. adult population receive at least one dose of vaccine by July 4. 

It’s a big goal, but we are already doing a remarkable job—together, we’ll get through this.",False,36960,
1396886878045970434,2021-05-24 17:52:39+00:00,"The American Rescue Plan is helping get us out of this crisis and back on track—but we can’t stop now. 

We must pass the American Jobs Plan to deliver millions of good-paying jobs.",False,35008,
1396849087845179394,2021-05-24 15:22:29+00:00,"RT @POTUS: The recent attacks on the Jewish community are despicable, and they must stop. I condemn this hateful behavior at home and abroa…",False,0,
1396579064777953285,2021-05-23 21:29:30+00:00,"More than 20,000 pharmacies coast to coast are now offering walk-in vaccinations with no appointment necessary. Find a location near you at https://t.co/EwdQ2dFHwG.",False,42549,
1396539256298954756,2021-05-23 18:51:19+00:00,"RT @POTUS: Since we took office, hunger rates have dropped 43% among adults. They’re at their lowest rates since the start of the pandemic.…",False,0,
1396140096269824008,2021-05-22 16:25:12+00:00,"The American Families Plan is a once-in-a-generation investment in the foundations of middle-class prosperity: education, health care, and child care.",False,29838,
1395772093422317579,2021-05-21 16:02:53+00:00,"Folks, let’s beat this virus once and for all. 
🔍 Visit https://t.co/EwdQ2dFHwG
💬 Text your ZIP code to 438829
📞 Call 1 (800) 232-0233

Together, #WeCanDoThis.",False,14669,
1395499181226266625,2021-05-20 21:58:26+00:00,"There are millions of Americans who, through no fault of their own, have been knocked flat on their back this past year. We’re determined to give them a fighting chance. That’s why we’ve been focused on vaccinating the nation and getting our economy running again.",False,39824,
1395469725493342210,2021-05-20 20:01:23+00:00,"RT @POTUS: Incidents of hate against Asian Americans have seen a shocking spike over the last year. It’s wrong — and it’s un-American.
 
To…",False,0,
1395183696769077248,2021-05-20 01:04:49+00:00,"Our country is moving in the right direction, but there’s still work to do to dig our way out of an economic collapse.

We must pass the American Jobs Plan to create millions of good-paying jobs rebuilding our country’s infrastructure.",False,36289,
1395125579284983810,2021-05-19 21:13:52+00:00,"We’re counting on you to roll up your sleeve, get vaccinated, and work together to change the course of this pandemic. 

Go to https://t.co/EwdQ2dFHwG to find the nearest place you can get a COVID-19 vaccine.",False,12726,
1394792535923507200,2021-05-18 23:10:29+00:00,Text your ZIP code to 438829 to find COVID-19 vaccination locations near you.,False,36167,
1394775653162098691,2021-05-18 22:03:24+00:00,"RT @POTUS: Being at Ford’s Rouge Electric Vehicle Center today brought me home. For more than thirty years, my Dad managed car dealerships…",False,0,
1394674549703286791,2021-05-18 15:21:39+00:00,"Help spread the word: From May 24 until July 4, Uber and Lyft will offer everyone in America free rides to and from COVID-19 vaccination sites.",False,144759,
1394459502011891712,2021-05-18 01:07:07+00:00,"In the battle against the COVID-19 pandemic, our nation is going to be the arsenal of vaccines for the rest of the world. https://t.co/LwU7Olic2V",False,18665,
1394426550733443079,2021-05-17 22:56:11+00:00,The light at the end of the tunnel is growing brighter every day. https://t.co/McB4q1bqX4,False,17612,
1394396502697680900,2021-05-17 20:56:47+00:00,"RT @POTUS: On this International Day Against Homophobia, Transphobia, and Biphobia, the message from the United States is clear: everyone d…",False,0,
1393580530021588994,2021-05-15 14:54:24+00:00,"RT @POTUS: I know folks have a lot of questions about COVID-19, the vaccines, and the latest mask guidance. So, we had the nation’s top exp…",False,0,
1393291157816365059,2021-05-14 19:44:32+00:00,"RT @POTUS: This is our moment to build an economy that works for everyone — not just the super-wealthy and giant corporations. 
 
Let’s get…",False,0,
1392979240681881603,2021-05-13 23:05:05+00:00,The CDC announced that they are no longer recommending that fully vaccinated people need to wear masks. https://t.co/pFhJEtBepq,False,16893,
1392958441807912962,2021-05-13 21:42:27+00:00,"This was made possible by the extraordinary success we’ve had in vaccinating so many Americans, so quickly. https://t.co/gTwM6Tp7lF",False,23388,
1392935976125833226,2021-05-13 20:13:10+00:00,"After a year of hard work and so much sacrifice, the rule is now simple: get vaccinated or wear a mask until you do.",False,158749,
1392934633814253573,2021-05-13 20:07:50+00:00,Getting vaccinated is easier than ever. You can find a vaccine site near you by texting your ZIP code to 438829.,False,28439,
1392932580027248645,2021-05-13 19:59:41+00:00,"Today is a great day for America in our long battle with COVID-19. 

Just a few hours ago, the CDC announced they are no longer recommending that fully vaccinated people need to wear masks.",False,52721,
1392907845578940419,2021-05-13 18:21:24+00:00,"RT @WhiteHouse: Big news from the CDC: If you’re fully vaccinated, you do not need to wear a mask – indoors or outdoors, in most settings.…",False,0,
1392887195418120192,2021-05-13 16:59:20+00:00,RT @POTUS: My Administration has mobilized a whole-of-government response to get more fuel quickly and safely to where it is needed and to…,False,0,
1392589979851841538,2021-05-12 21:18:18+00:00,Getting a COVID-19 vaccine has never been easier. Go to https://t.co/EwdQ2dFHwG to find a location near you.,False,26369,
1392584115619303425,2021-05-12 20:55:00+00:00,"RT @POTUS: Tomorrow we will cross 250 million vaccine shots administered since we took office. 

It’s a truly remarkable achievement for th…",False,0,
1392226915973488642,2021-05-11 21:15:37+00:00,"We’re vaccinating the nation. We’re creating hundreds of thousands of jobs. We’re delivering real results people can see and feel in their own lives.
  
That’s the essence of America. That’s democracy in action.",False,66588,
1392184052128657414,2021-05-11 18:25:18+00:00,RT @POTUS: We’re working hard to ensure transportation is less of a barrier when it comes to getting a COVID-19 vaccine. And I’m excited to…,False,0,
1391796788055711753,2021-05-10 16:46:27+00:00,"The American Families Plan addresses four of the biggest challenges facing American families:
✅Access to a good education, including universal Pre-K
✅Quality, affordable child care
✅Up to 12 weeks of paid family and medical leave
✅Money directly into the pockets of families",False,18980,
1391501156183068678,2021-05-09 21:11:43+00:00,RT @POTUS: This has been an extraordinarily tough year for moms across this country. To all the moms who have carried us through this pande…,False,0,
1391422726389309447,2021-05-09 16:00:04+00:00,"To moms everywhere, wishing you a safe and happy Mother’s Day. 

Share your favorite quote from your mother below. https://t.co/6gZ1siDh5y",False,28035,
1391058805509742599,2021-05-08 15:53:58+00:00,Nearly 90% of the infrastructure jobs created in the American Jobs Plan don't require a college degree. It’s a blue-collar blueprint to build America.,False,69821,
1391036614361616389,2021-05-08 14:25:47+00:00,RT @POTUS: I am proud of the people I go to work with at the White House every day — but my pride can’t hold a candle to that of their moth…,False,0,
1390763244713922561,2021-05-07 20:19:31+00:00,"Since the beginning of our administration, the economy has added more than 1.5 million jobs. 

We’ve still got work to do, but America is moving in the right direction. https://t.co/B0bNPXNSKe",False,14553,
1390698029376843789,2021-05-07 16:00:22+00:00,RT @POTUS: Tune in as I discuss the April jobs report. https://t.co/BUZiB5w1gj,False,0,
1390345049716805632,2021-05-06 16:37:45+00:00,RT @WhiteHouse: This week we launched the Restaurant Revitalization Fund to provide direct relief to restaurants and other hard-hit food es…,False,0,
1390016508559077380,2021-05-05 18:52:15+00:00,"RT @POTUS: If we want our economy to recover in a way that deals everyone in, then our restaurants need a seat at the table — with the Amer…",False,0,
1389656643852451847,2021-05-04 19:02:17+00:00,RT @POTUS: Our goal by July 4th is to have 70% of adult Americans with at least one shot — and 160 million Americans fully vaccinated. It’s…,False,0,
1389328881652572166,2021-05-03 21:19:52+00:00,"Georgia, when you sent @Ossoff and @ReverendWarnock to the Senate, you made history. Thank you. https://t.co/47KY4Tm9hv",False,53981,
1389212356736126976,2021-05-03 13:36:50+00:00,RT @POTUS: Teachers are an extraordinary force for good in our nation — I’m lucky enough to be married to one and have seen firsthand how h…,False,0,
1388957075703803906,2021-05-02 20:42:27+00:00,"America is on the move again. 

We are choosing hope over fear. 
Truth over lies. 
Light over darkness. 

There’s nothing we cannot do if we do it together.",False,96658,
1388581577714720772,2021-05-01 19:50:21+00:00,Democracy can deliver for the American people. https://t.co/UZ4BDIVoPf,False,17138,
1388557988932333574,2021-05-01 18:16:37+00:00,"RT @TheDemocrats: Elections make a difference. Thank you, Georgia. https://t.co/hKn1vIIr7Y",False,0,
1388540850167287811,2021-05-01 17:08:31+00:00,"RT @POTUS: This May, during Asian American and Native Hawaiian/Pacific Islander Heritage Month, we recognize the history and achievements o…",False,0,
1388533738934579201,2021-05-01 16:40:15+00:00,We’ve never been more optimistic about the future of America. https://t.co/EBHlCb2P84,False,75610,
1388262351967825928,2021-04-30 22:41:52+00:00,"Thank you, Georgia, for everything. https://t.co/1Ci4pFJ4os",False,68217,
1388204128074076161,2021-04-30 18:50:30+00:00,RT @POTUS: Join me at Philadelphia’s 30th Street Station as we celebrate Amtrak’s 50th Anniversary. https://t.co/HuPetlGvaU,False,0,
1387861106966806536,2021-04-29 20:07:27+00:00,"In Georgia with @DrBiden to celebrate the successes of the first 100 days of the Biden-Harris administration. Jobs are coming back, folks are getting vaccinated, and better days are ahead. Tune in. 
https://t.co/v1B30kekja",False,7790,
1387800729281236997,2021-04-29 16:07:32+00:00,100 days in—and America is getting back on track.,False,134371,
1387591082918260740,2021-04-29 02:14:29+00:00,"RT @POTUS: If we are to truly restore the soul of America, then we need to protect the sacred right to vote.

Congress should pass H.R. 1 a…",False,0,
1387585909378461702,2021-04-29 01:53:55+00:00,"RT @POTUS: Trickle-down economics has never worked.

It’s time to grow the economy from the bottom up and middle out.",False,0,
1387577532510310401,2021-04-29 01:20:38+00:00,"RT @POTUS: 100 days ago, America’s house was on fire. We had to act, so we:

- Passed the American Rescue Plan
- Administered over 200 mill…",False,0,
1387572764740145157,2021-04-29 01:01:41+00:00,"Together, we’re getting back on track. Tune in now for our administration’s first joint address to Congress. https://t.co/WWjl35N2Em",False,8096,
1387476414098780165,2021-04-28 18:38:49+00:00,"RT @POTUS: To make tonight’s joint address accessible for all Americans, every White House livestream will have American Sign Language (ASL…",False,0,
1387421807158890507,2021-04-28 15:01:50+00:00,"Before tonight’s joint address to Congress, join @DrBiden and Mayor @KeishaBottoms for a call to thank our grassroots supporters. Sign up here to join them: https://t.co/tF9AJStpL6",False,5468,
1387154433985888260,2021-04-27 21:19:23+00:00,"With the first 100 days of our administration under our belt, America is getting back on track—all thanks to the support of grassroots volunteers. Help us keep the momentum going by joining our Week of Action: https://t.co/alyMSnBATt",False,16024,
1387127637164822529,2021-04-27 19:32:54+00:00,"RT @POTUS: I believe no one should work full time and still live in poverty. That’s why today, I raised the minimum wage to $15 an hour for…",False,0,
1386805471084941312,2021-04-26 22:12:44+00:00,"The American Jobs Plan will strengthen unions, help protect workers, and rebuild our economy. https://t.co/sHNa1eRfiB",False,21327,
1386757820834586626,2021-04-26 19:03:23+00:00,"RT @POTUS: Today, we’re launching a new program funded by the American Rescue Plan to provide nutrition assistance to more than 30 million…",False,0,
1386426190861197313,2021-04-25 21:05:37+00:00,"Get vaccinated, America.",False,206031,
1386405977348472834,2021-04-25 19:45:17+00:00,"RT @POTUS: Just as India sent assistance to the United States as our hospitals were strained early in the pandemic, we are determined to he…",False,0,
1386076233147076608,2021-04-24 21:55:00+00:00,"RT @POTUS: Before I took office, I promised help was on the way. Just three months in, I’m proud to say help is here. We’ve delivered over…",False,0,
1385996697180979201,2021-04-24 16:38:57+00:00,Let’s close the digital divide once and for all. Our American Jobs Plan will make sure every American has access to high-speed internet. https://t.co/Ru1NSfN7C0,False,23397,
1385624057916362752,2021-04-23 15:58:13+00:00,Heading back to Georgia with @DrBiden next Thursday to mark 100 days of our administration and thank folks for helping us build back better as a nation. See you soon!,False,49880,
1385281605757964288,2021-04-22 17:17:26+00:00,"RT @WhiteHouse: Before taking office, President Biden set a bold goal of 100 million shots in his first 100 days.
 
After reaching the goal…",False,0,
1385281546932916224,2021-04-22 17:17:12+00:00,RT @POTUS: America is back. We rejoined the Paris Agreement and are ready to rally the world to tackle the climate crisis. Let’s do this.,False,0,
1384907441264025604,2021-04-21 16:30:38+00:00,"RT @POTUS: The guilty verdict does not bring back George Floyd. But through the family’s pain, they are finding purpose so George’s legacy…",False,0,
1384648033024020485,2021-04-20 23:19:51+00:00,"RT @POTUS: Today, a jury in Minnesota found former Minneapolis Police Officer Derek Chauvin guilty of murdering George Floyd.
 
The verdict…",False,0,
1384645067672104961,2021-04-20 23:08:04+00:00,RT @WhiteHouse: Live: President Biden and Vice President Harris address the nation on the verdict in the trial of Derek Chauvin. https://t.…,False,0,
1384560761746477062,2021-04-20 17:33:04+00:00,"If we act now on the American Jobs Plan, in 50 years, people will look back and say this was the moment that America won the future. https://t.co/ZOJGr9E2i3",False,18956,
1384243762289811457,2021-04-19 20:33:25+00:00,"Today, every adult is eligible to get a COVID-19 vaccine. Better days are ahead.",False,183130,
1383781759557410822,2021-04-18 13:57:35+00:00,"RT @POTUS: Imagine a future where we lead the world and tackle the threat of climate change with American jobs and ingenuity.

We can make…",False,0,
1383171354778873859,2021-04-16 21:32:03+00:00,RT @POTUS: Vice President Harris and I have been briefed on the mass shooting at a FedEx facility in Indianapolis. God bless the eight indi…,False,0,
1383116985630875652,2021-04-16 17:56:01+00:00,RT @POTUS: I’m looking forward to welcoming my friend Prime Minister Suga to the White House this afternoon for the first foreign leader vi…,False,0,
1382407002794700801,2021-04-14 18:54:48+00:00,"RT @POTUS: It is time to end America’s longest war. 

It is time for American troops to come home from Afghanistan.",False,0,
1382381317279604736,2021-04-14 17:12:44+00:00,RT @WHCOVIDResponse: We continue to make progress in our work to vaccinate as many adults in this country as we can. Our current 7-day dail…,False,0,
1382129231291936770,2021-04-14 00:31:02+00:00,"RT @POTUS: Today, the FDA and CDC recommended a pause in the use of the Johnson &amp; Johnson vaccine. Here’s what you need to know: https://t.…",False,0,
1382076868363444225,2021-04-13 21:02:57+00:00,"RT @POTUS: “When the will defies fear, when duty throws the gauntlet down to fate, when honor scorns to compromise with death — that is her…",False,0,
1382061069024305152,2021-04-13 20:00:10+00:00,"RT @POTUS: Race should never determine health outcomes — and pregnancy and childbirth should be safe for all. But for too many Black women,…",False,0,
1381758062860587009,2021-04-12 23:56:08+00:00,"RT @POTUS: Today I’m thinking about Daunte Wright and his family — and the pain, anger, and trauma that Black America experiences every day…",False,0,
1381027031014633474,2021-04-10 23:31:17+00:00,RT @POTUS: Gun violence in this country is an epidemic — and it’s long past time Congress take action.,False,0,
1380585611841667072,2021-04-09 18:17:14+00:00,RT @WHCOVIDResponse: More than 112 million Americans have received at least one dose and more than 66 million adult Americans are now fully…,False,0,
1380277797902487555,2021-04-08 21:54:05+00:00,"RT @POTUS: My Administration is taking initial steps to reduce gun violence, including:

- Stopping the proliferation of ghost guns
- Regul…",False,0,
1380188766954983426,2021-04-08 16:00:19+00:00,"RT @POTUS: Today, I’m joining Vice President Harris and Attorney General Garland to announce new actions to reduce gun violence. Tune in. h…",False,0,
1379904346666770433,2021-04-07 21:10:08+00:00,RT @WhiteHouse: Clean drinking water is infrastructure. The American Jobs Plan will improve our water infrastructure by replacing 100% of t…,False,0,
1379543174310428676,2021-04-06 21:14:58+00:00,"RT @POTUS: I’m proud to share that yesterday, we crossed 150 million shots in just 75 days of my Administration — on our way to hitting our…",False,0,
1379527249314086920,2021-04-06 20:11:41+00:00,RT @POTUS: My Administration is working to get America vaccinated as quickly as possible. Tune in as I provide an update on our progress an…,False,0,
1379175862445223936,2021-04-05 20:55:24+00:00,RT @POTUS: Here’s the deal: Wall Street didn’t build this country — the great American middle class did. It’s time we rebuild the middle cl…,False,0,
1378718350617022471,2021-04-04 14:37:24+00:00,"RT @POTUS: From our family to yours, we wish you health, hope, joy, and peace. Happy Easter, everyone! https://t.co/3NHPrbFCVt",False,0,
1378358923237994496,2021-04-03 14:49:10+00:00,"RT @POTUS: This week, I announced the American Jobs Plan, which will invest in our infrastructure and strengthen America’s competitiveness…",False,0,
1377727948543963145,2021-04-01 21:01:54+00:00,RT @POTUS: The American Jobs Plan will ensure every American can turn on the faucet or fountain and drink clean water. https://t.co/V1WT3Tk…,False,0,
1377434193827860480,2021-04-01 01:34:37+00:00,The American Jobs Plan is the largest American jobs investment since World War II.,False,100319,
1377414548097880068,2021-04-01 00:16:34+00:00,"Under the American Jobs Plan, 100% of our nation’s lead pipes and service lines will be replaced—so every child in America can turn on the faucet or fountain and drink clean water. 

We cannot delay another minute.",False,51790,
1377385089340829700,2021-03-31 22:19:30+00:00,"Wall Street didn’t build this country—the great American middle class did. This time, when we rebuild the middle class under the American Jobs Plan, we’re bringing everyone along.",False,102498,
1377367815120957445,2021-03-31 21:10:52+00:00,"Delivering for the American people is what the American Rescue Plan was about. It’s what the American Jobs Plan is about.

We can do this.
We have to do this.
We will do this.",False,18110,
1377363181387980800,2021-03-31 20:52:27+00:00,"The American Jobs Plan is a once-in-a-generation investment in America. It will:
✅Modernize 20,000 miles of highways, roads, and main streets
✅Repair 10,000 bridges desperately in need of upgrades 
✅Replace 100% of our nation’s lead pipes and service lines",False,24136,
1377361641491300354,2021-03-31 20:46:20+00:00,"Millions of Americans lost their jobs last year.

Here’s the truth: We all do better when we all do well. It’s time to build our economy from the bottom up—and the middle out—not the top down.",False,44018,
1376934713617756163,2021-03-30 16:29:52+00:00,RT @POTUS: We can’t be silent in the face of rising violence against Asian Americans. That’s why today I’m taking additional steps to respo…,False,0,
1376636582866923526,2021-03-29 20:45:12+00:00,"RT @POTUS: I’m proud to announce that three weeks from today, 90% of adults will be eligible to get vaccinated — and 90% of Americans will…",False,0,
1376602924097343494,2021-03-29 18:31:27+00:00,RT @POTUS: Vice President Harris and I just wrapped up a COVID-19 briefing. Tune in as I give an update on our response to the virus and th…,False,0,
1376227712533155845,2021-03-28 17:40:30+00:00,"RT @POTUS: Two weeks ago, I directed all states, tribes, and territories to make all adult Americans eligible for the vaccine no later than…",False,0,
1375862625997893634,2021-03-27 17:29:46+00:00,"RT @WhiteHouse: Megan Rapinoe, Margaret Purce, and countless others have been leading the fight for pay equality. This week, the President…",False,0,
1375551858807341057,2021-03-26 20:54:54+00:00,"RT @POTUS: As we recall the Passover story of overcoming adversity, finding hope, and becoming free, we find a renewed salience. This weeke…",False,0,
1375511738443984896,2021-03-26 18:15:28+00:00,"RT @POTUS: I ran for president for three reasons: to restore the soul of the nation, rebuild the middle class, and unite the country. https…",False,0,
1375192104469663750,2021-03-25 21:05:22+00:00,"RT @POTUS: Before I took office, I set a big goal of 100 million shots in my first 100 days.
 
We hit the goal on day 58.
 
Now, I’m settin…",False,0,
1375137400033144832,2021-03-25 17:27:59+00:00,"RT @POTUS: This afternoon, I’m holding my first formal press conference as president. Tune in. https://t.co/dvl1RAtOjr",False,0,
1374761947913146374,2021-03-24 16:36:04+00:00,"RT @WHCOVIDResponse: In total, 84 million people -- about 1 in 3 adults -- have received at least one dose of the vaccine and more than 45…",False,0,
